[
  {
    "product_id": "10001",
    "name": "Продукт 1 SmartWear",
    "description": "Описание продукта 1 категории Одежда, бренд SmartWear.",
    "price": {
      "amount": 14253.46,
      "currency": "RUB"
    },
    "category": "Одежда",
    "brand": "SmartWear",
    "stock": {
      "available": 75,
      "reserved": 9
    },
    "sku": "SmartWear-10001",
    "tags": [
      "мода",
      "стиль",
      "одежда",
      "кэжуал",
      "ткань"
    ],
    "images": [
      {
        "url": "https://example.com/images/product1.jpg",
        "alt": "Изображение продукта 1 - вид спереди"
      },
      {
        "url": "https://example.com/images/product1_side.jpg",
        "alt": "Изображение продукта 1 - вид сбоку"
      }
    ],
    "specifications": {
      "weight": "272g",
      "dimensions": "19mm x 5mm x 38mm",
      "battery_life": "40 hours",
      "water_resistance": "IP67"
    },
    "created_at": "2023-11-04T20:14:46Z",
    "updated_at": "2023-11-19T14:47:31Z",
    "index": "products",
    "store_id": "store_003"
  },
  {
    "product_id": "10002",
    "name": "Продукт 2 GadgetPro",
    "description": "Описание продукта 2 категории Автотовары, бренд GadgetPro.",
    "price": {
      "amount": 8808.49,
      "currency": "RUB"
    },
    "category": "Автотовары",
    "brand": "GadgetPro",
    "stock": {
      "available": 56,
      "reserved": 26
    },
    "sku": "GadgetPro-10002",
    "tags": [
      "авто",
      "запчасти",
      "автомобиль",
      "вождение",
      "комфорт"
    ],
    "images": [
      {
        "url": "https://example.com/images/product2.jpg",
        "alt": "Изображение продукта 2 - вид спереди"
      },
      {
        "url": "https://example.com/images/product2_side.jpg",
        "alt": "Изображение продукта 2 - вид сбоку"
      }
    ],
    "specifications": {
      "weight": "388g",
      "dimensions": "31mm x 40mm x 22mm",
      "battery_life": "28 hours",
      "water_resistance": "IP20"
    },
    "created_at": "2023-11-28T16:48:45Z",
    "updated_at": "2023-12-09T19:58:08Z",
    "index": "products",
    "store_id": "store_010"
  },
  {
    "product_id": "10003",
    "name": "Продукт 3 XYZ",
    "description": "Описание продукта 3 категории Автотовары, бренд XYZ.",
    "price": {
      "amount": 10896.43,
      "currency": "RUB"
    },
    "category": "Автотовары",
    "brand": "XYZ",
    "stock": {
      "available": 93,
      "reserved": 5
    },
    "sku": "XYZ-10003",
    "tags": [
      "авто",
      "запчасти",
      "автомобиль",
      "вождение",
      "комфорт"
    ],
    "images": [
      {
        "url": "https://example.com/images/product3.jpg",
        "alt": "Изображение продукта 3 - вид спереди"
      },
      {
        "url": "https://example.com/images/product3_side.jpg",
        "alt": "Изображение продукта 3 - вид сбоку"
      }
    ],
    "specifications": {
      "weight": "384g",
      "dimensions": "31mm x 49mm x 23mm",
      "battery_life": "45 hours",
      "water_resistance": "IP67"
    },
    "created_at": "2023-10-27T03:03:27Z",
    "updated_at": "2023-12-30T13:59:50Z",
    "index": "products",
    "store_id": "store_008"
  },
  {
    "product_id": "10004",
    "name": "Продукт 4 FastElectro",
    "description": "Описание продукта 4 категории Спорт, бренд FastElectro.",
    "price": {
      "amount": 4112.94,
      "currency": "RUB"
    },
    "category": "Спорт",
    "brand": "FastElectro",
    "stock": {
      "available": 371,
      "reserved": 41
    },
    "sku": "FastElectro-10004",
    "tags": [
      "фитнес",
      "спорт",
      "тренировка",
      "активность",
      "оборудование"
    ],
    "images": [
      {
        "url": "https://example.com/images/product4.jpg",
        "alt": "Изображение продукта 4 - вид спереди"
      },
      {
        "url": "https://example.com/images/product4_side.jpg",
        "alt": "Изображение продукта 4 - вид сбоку"
      }
    ],
    "specifications": {
      "weight": "33g",
      "dimensions": "23mm x 50mm x 16mm",
      "battery_life": "7 hours",
      "water_resistance": "IP67"
    },
    "created_at": "2023-03-27T21:11:16Z",
    "updated_at": "2023-10-23T04:06:07Z",
    "index": "products",
    "store_id": "store_006"
  },
  {
    "product_id": "10005",
    "name": "Продукт 5 HomeTech",
    "description": "Описание продукта 5 категории Спорт, бренд HomeTech.",
    "price": {
      "amount": 5630.93,
      "currency": "RUB"
    },
    "category": "Спорт",
    "brand": "HomeTech",
    "stock": {
      "available": 83,
      "reserved": 18
    },
    "sku": "HomeTech-10005",
    "tags": [
      "фитнес",
      "спорт",
      "тренировка",
      "активность",
      "оборудование"
    ],
    "images": [
      {
        "url": "https://example.com/images/product5.jpg",
        "alt": "Изображение продукта 5 - вид спереди"
      },
      {
        "url": "https://example.com/images/product5_side.jpg",
        "alt": "Изображение продукта 5 - вид сбоку"
      }
    ],
    "specifications": {
      "weight": "117g",
      "dimensions": "30mm x 21mm x 5mm",
      "battery_life": "5 hours",
      "water_resistance": "IP68"
    },
    "created_at": "2023-08-17T12:22:08Z",
    "updated_at": "2023-09-21T18:50:32Z",
    "index": "products",
    "store_id": "store_008"
  },
  {
    "product_id": "10006",
    "name": "Продукт 6 HomeTech",
    "description": "Описание продукта 6 категории Игрушки, бренд HomeTech.",
    "price": {
      "amount": 5133.52,
      "currency": "RUB"
    },
    "category": "Игрушки",
    "brand": "HomeTech",
    "stock": {
      "available": 155,
      "reserved": 9
    },
    "sku": "HomeTech-10006",
    "tags": [
      "дети",
      "развлечение",
      "развитие",
      "игрушка",
      "безопасность"
    ],
    "images": [
      {
        "url": "https://example.com/images/product6.jpg",
        "alt": "Изображение продукта 6 - вид спереди"
      },
      {
        "url": "https://example.com/images/product6_side.jpg",
        "alt": "Изображение продукта 6 - вид сбоку"
      }
    ],
    "specifications": {
      "weight": "123g",
      "dimensions": "32mm x 29mm x 16mm",
      "battery_life": "29 hours",
      "water_resistance": "IP44"
    },
    "created_at": "2023-07-02T11:37:24Z",
    "updated_at": "2023-12-10T00:45:58Z",
    "index": "products",
    "store_id": "store_001"
  },
  {
    "product_id": "10007",
    "name": "Продукт 7 SmartWear",
    "description": "Описание продукта 7 категории Спорт, бренд SmartWear.",
    "price": {
      "amount": 14640.22,
      "currency": "RUB"
    },
    "category": "Спорт",
    "brand": "SmartWear",
    "stock": {
      "available": 40,
      "reserved": 15
    },
    "sku": "SmartWear-10007",
    "tags": [
      "фитнес",
      "спорт",
      "тренировка",
      "активность",
      "оборудование"
    ],
    "images": [
      {
        "url": "https://example.com/images/product7.jpg",
        "alt": "Изображение продукта 7 - вид спереди"
      },
      {
        "url": "https://example.com/images/product7_side.jpg",
        "alt": "Изображение продукта 7 - вид сбоку"
      }
    ],
    "specifications": {
      "weight": "353g",
      "dimensions": "13mm x 14mm x 29mm",
      "battery_life": "22 hours",
      "water_resistance": "IP20"
    },
    "created_at": "2023-10-22T18:04:50Z",
    "updated_at": "2023-12-04T15:12:12Z",
    "index": "products",
    "store_id": "store_005"
  },
  {
    "product_id": "10008",
    "name": "Продукт 8 EcoGoods",
    "description": "Описание продукта 8 категории Автотовары, бренд EcoGoods.",
    "price": {
      "amount": 1821.6,
      "currency": "RUB"
    },
    "category": "Автотовары",
    "brand": "EcoGoods",
    "stock": {
      "available": 407,
      "reserved": 4
    },
    "sku": "EcoGoods-10008",
    "tags": [
      "авто",
      "запчасти",
      "автомобиль",
      "вождение",
      "комфорт"
    ],
    "images": [
      {
        "url": "https://example.com/images/product8.jpg",
        "alt": "Изображение продукта 8 - вид спереди"
      },
      {
        "url": "https://example.com/images/product8_side.jpg",
        "alt": "Изображение продукта 8 - вид сбоку"
      }
    ],
    "specifications": {
      "weight": "106g",
      "dimensions": "40mm x 13mm x 24mm",
      "battery_life": "25 hours",
      "water_resistance": "IP54"
    },
    "created_at": "2023-06-10T16:31:14Z",
    "updated_at": "2023-07-13T18:48:47Z",
    "index": "products",
    "store_id": "store_006"
  },
  {
    "product_id": "10009",
    "name": "Продукт 9 ABC",
    "description": "Описание продукта 9 категории Спорт, бренд ABC.",
    "price": {
      "amount": 4592.91,
      "currency": "RUB"
    },
    "category": "Спорт",
    "brand": "ABC",
    "stock": {
      "available": 70,
      "reserved": 29
    },
    "sku": "ABC-10009",
    "tags": [
      "фитнес",
      "спорт",
      "тренировка",
      "активность",
      "оборудование"
    ],
    "images": [
      {
        "url": "https://example.com/images/product9.jpg",
        "alt": "Изображение продукта 9 - вид спереди"
      },
      {
        "url": "https://example.com/images/product9_side.jpg",
        "alt": "Изображение продукта 9 - вид сбоку"
      }
    ],
    "specifications": {
      "weight": "31g",
      "dimensions": "29mm x 28mm x 22mm",
      "battery_life": "28 hours",
      "water_resistance": "IP54"
    },
    "created_at": "2023-08-05T02:43:04Z",
    "updated_at": "2023-09-28T06:56:22Z",
    "index": "products",
    "store_id": "store_010"
  },
  {
    "product_id": "10010",
    "name": "Продукт 10 SmartWear",
    "description": "Описание продукта 10 категории Автотовары, бренд SmartWear.",
    "price": {
      "amount": 11554.13,
      "currency": "RUB"
    },
    "category": "Автотовары",
    "brand": "SmartWear",
    "stock": {
      "available": 225,
      "reserved": 29
    },
    "sku": "SmartWear-10010",
    "tags": [
      "авто",
      "запчасти",
      "автомобиль",
      "вождение",
      "комфорт"
    ],
    "images": [